{
  "name": "static-site-ruleset",
  "target": "branch",
  "enforcement": "active",
  "conditions": {
    "ref_name": { "include": ["main"], "exclude": [] }
  },
  "rules": [
    {
      "type": "pull_request",
      "parameters": {
        "required_approving_review_count": 1,
        "require_last_push_approval": true
      }
    },
    {
      "type": "required_status_checks",
      "parameters": {
        "required_status_checks": [
          "build",
          "test"
        ],
        "strict_required_status_checks_policy": false
      }
    },
    {
      "type": "non_fast_forward"
    }
  ],
  "metadata": {
    "version": "1.0.0",
    "created": "2026-02-05",
    "updated": "2026-02-05",
    "description": "Flexible protection rules for static websites with build and test requirements",
    "tags": ["static-site", "web", "flexible"]
  }
}
