{
  "name": "documentation-site-main",
  "target": "branch",
  "enforcement": "active",
  "conditions": {
    "ref_name": {
      "include": ["main"],
      "exclude": []
    }
  },
  "rules": [
    {
      "type": "pull_request",
      "parameters": {
        "required_approving_review_count": 1,
        "dismiss_stale_reviews_on_push": true,
        "require_code_owner_review": false,
        "require_last_push_approval": true
      }
    },
    {
      "type": "required_status_checks",
      "parameters": {
        "strict_required_status_checks_policy": true,
        "required_status_checks": [
          { "context": "docs build" }
        ]
      }
    },
    {
      "type": "non_fast_forward"
    },
    {
      "type": "commit_message_pattern",
      "parameters": {
        "name": "Docs-Friendly Commits",
        "pattern": "^(docs|chore|ci|fix)(\\(.+\\))?: .+",
        "negate": false
      }
    }
  ],
  "metadata": {
    "version": "1.0.0",
    "created": "2026-02-05",
    "updated": "2026-02-05",
    "description": "Protection rules for documentation sites with build validation and documentation-focused commit messages",
    "tags": ["documentation", "web", "docs-build"]
  }
}
